content,title,id
"The Voice of Romance: The Columbia Original Album Collection

The Voice of Romance: The Columbia Original Album Collection is a 68-disc box set by American pop singer Johnny Mathis that was released on December 8, 2017, by Legacy Recordings, a division of Sony Music Entertainment. The packaging noted that it includes 67 albums that have been remastered, several of which were being made available on CD for the first time. Two of those, ""I Love My Lady"" and ""The Island"", were debuting in their entirety for the first time anywhere, and 38 of the bonus tracks included had also previously gone unreleased. 

In his review of the box set for The Second Disc, Joe Marchese asserted, ""What it reveals is that the history of Johnny Mathis is, put simply, the history of American music in the second half of the twentieth century."" In summation he wrote, ""Since Johnny Mathis's recording debut, virtually everything has changed about the sound of music, not to mention the music industry. But Mathis has held steadfast to his core values as an artist, and as a 'singer's singer,' as he’s happily traversed from genre to genre. That consistence of quality and variation of style makes the immersive journey contained in ""The Voice of Romance: The Columbia Original Album Collection"" one well worth taking for any fan or collector of American popular song. Basking in the glow of this nostalgic trip, you just might get misty yourself.""

Recording dates and release information taken from the liner notes.

Recording dates and release information taken from the liner notes.


Credits taken from the liner notes.


Credits taken from the liner notes.


Images courtesy of Rojon Productions & Sony Music Photo Archives:

Chart positions courtesy of Joel Whitburn & Billboard Publications",The Voice of Romance  The Columbia Original Album Collection,239
"Promisedland, Queensland

Promisedland is a locality in the Bundaberg Region, Queensland, Australia.

The Burnett River forms the north-western boundary of the locality. The Ned Churchward Weir (originally called the Walla Weir) was built in 1998 across the river between Promisedland and Bungadoo to provide water for irrigation.",Promisedland  Queensland,240
"Kavita (kabaddi, born 1987)

Kavita born 12 December 1987 is representative for India in the sport of Kabaddi. She was a member of the team that won a gold medal in the 2010 Asian games in Guangzhou.",Kavita  kabaddi  born 1987 ,241
"2017–18 Harvard Crimson women's basketball team

The 2017–18 Harvard Crimson women's basketball team represents Harvard University during the 2017–18 NCAA Division I women's basketball season. The Crimson, led by thirty-sixth year head coach Kathy Delaney-Smith, play their home games at the Lavietes Pavilion and are members of the Ivy League.

They finished the season 21–6, 8–6 in Ivy League play to finish in third place. They lost in the semifinals of the Ivy Women's Tournament to Princeton. They were invited to the WNIT where defeated New Hampshire in the first round before losing to St. John's in the second round.

!colspan=8 style=| Regular season
!colspan=8 style=| Ivy League Tournament

2017–18 NCAA Division I women's basketball rankings",2017–18 Harvard Crimson women s basketball team,242
"Fighting Cocks railway station

Fighting Cocks railway station was a railway station on the original course of the Stockton & Darlington Railway (S&DR) which served the villages of Middleton St George and Low Dinsdale in Darlington, part of the Ceremonial County of Durham, as well the once popular Dinsdale Spa Hotel from 1829.

When the Stockton & Darlington Railway first opened on 10 October 1825, there were no official stations as passenger trains were provided by independent coach operators who purchased a licence to the railway company to enable them to operate on the line. Tickets were therefore sold by local publicans and so it has been claimed that the Fighting Cocks public house, a coaching inn located adjacent to where the railway crossed Rykeneild Street, could be the oldest station booking office in the World. It was not until the success of passenger services on the Liverpool & Manchester Railway persuaded the S&DR to purchase the coach operators and in December 1833 it began to operate its own locomotive-hauled passenger service.

In 1829, the Dinsdale Spa Hotel was opened close to the village of Low Dinsdale which led to an increase in travel to the village using the railway. As a result a permanent station was opened during the 1830s (appearing in timetables by 1838), on the east side of the level crossing, to cater for this traffic. It was originally called 'Middleton and Dinsdale' but was renamed 'Fighting Cocks' in 1866.

In 1863 the S&DR was amalgamated into the North Eastern Railway (NER) who, on 1 July 1887 opened a new line from south of Darlington Bank Top station to Oak Tree Junction, east of Fighting Cocks station, to enable passenger services on the ex-S&DR route to serve Bank Top station. However the opening of this new route meant that Fighting Cocks was bypassed and so a new station was provided at to replace it. Over the course of its life as a passenger station, approximately 30,000 passenger tickets were sold to Fighting Cocks. From this point on Fighting Cocks was only served by goods trains until it was closed completely as an economy measure in 1964.

The line through the station remained as a through line until it was severed as the western end on 21 May 1967 though it was partially retained as a short branch line from Oak Tree Junction until the 1970s.

A public footpath now runs along the alignment of the railway through the sight of the station.",Fighting Cocks railway station,243
"Bucher Bridge

The Bucher Bridge, located off U.S. Route 77 near the town of Rock in Cowley County, Kansas, was listed on the National Register of Historic Places in 1985. It is located about north and west of Rock.

Also known as Eight Mile Creek Bridge, the bridge crosses Eight Mile Creek. It is long and wide. It was completed in 1905 by Walter Sharp of El Dorado and constructed of solid concrete. It is a concrete arch bridge, and is possibly reinforced by steel. It has short limestone wing walls.

It is possibly just the second bridge of this type built by Walter Sharp, who was experimenting. The township did not complete the approaches to the bridge, so people in the area who would use the bridge got together and built the approaches.",Bucher Bridge,244
"Chubsucker minnow

The chubsucker minnow (""Tampichthys erimyzonops"") is a species of cyprinid fish endemic to Mexico.",Chubsucker minnow,245
"Sculpture in Mexico

Sculpture is one of the oldest arts in Mexico. In Prehispanic Mexico, it is present in pyramids, sanctuaries, esplanades and communal objects; examples of this are the Olmec, Mayan, Teotihuacan, Tarascan, Mixtec and Aztec sculptures.

Many of these sculptures have been cataloged as masterpieces and stand out for their monumentality, since many of them are huge and exposed to be seen publicly.

Sculpture after the conquest is divided into two areas: decorative and statuary. Both were made in stone or wood. Plateresque art was essentially sculptural and in the Colony it produced important altarpieces. 

In the cathedral of Mexico, work Claudio Arciniega and Juan Miguel Agüero. It will become the paradigm of colonial architecture. Francisco Becerra will raise the cathedral of Puebla. Francisco Antonio Guerrero y Torres: Chapel of the Pocito, in the Villa de Guadalupe. In Puebla, a very active baroque school appears. Sanctuaries of Ocotlán in Tlaxcala, and of San Francisco de Acatepec, two magnificent examples of the Novohispano Baroque.

In all the colonial cities, fine finishes in the ornamentation and the facades of the churches can be appreciated. Oaxaca and its numerous temples like Soledad and Santo Domingo show the beauty and magnificence of it.

The academies created in Europe from the s17th century were founded on the rational abandoning the purely religious vision that had dominated the previous centuries. In New Spain, this philosophy sparked a reaction against the baroque. Thus, altarpieces that were essentially sculptural were considered overloaded and replaced by architectural manifestations. The central figure of this era in New Spain is the Spaniard Manuel Tolsá.

Romanticism tended to break the norms and strict models of classicism, as it pursued ideas influenced by realism and nationalism. Religious sculpture was reduced to sporadic imagery, while secular sculpture continued in portraits and monumental art of a civic nature.1

Between 1820 and 1880 the predominant themes were, successively: religious images, biblical scenes, allegories to the symbols of the insurgency movement and scenes and characters of pre-Cortesian history, and portraits of the old aristocracy, of the rising bourgeoisie and champions of the pre revolution. The transcendent sphere consisted in introducing civil reasons, the first national types and glimpses of a current of self expression.

Differentiated by its objectives and the emphasis of its theme, three currents emerged: an indigenist, archaic and folkloric; another, neoclassical, civic and historical; and a third, socialist, with ideological propaganda.

During the 20th century, great exponents of Mexican sculpture are Rómulo Rozo, Enrique Gottdiener Soto, Juan Soriano, José Luis Cuevas, Sebastián and Mathias Goeritz.",Sculpture in Mexico,246
"2018 German Figure Skating Championships

The 2018 German Figure Skating Championships () were a competition in the 2017–18 figure skating season. Skaters competed in the disciplines of men's singles, ladies' singles, pair skating, and ice dancing for the title of national champion of Germany. The results of the national championships were among the criteria used to choose the German teams to the 2018 World and European Championships. Skaters competed on the senior, junior, and novice levels.

The 2017–18 senior competition was held in Frankfurt from 14-16 December 2017.",2018 German Figure Skating Championships,247
"Kavita (kabaddi, born 1993)

Kavita born 10 January 1993 is representative for India in the sport of Kabaddi. She was a member of the team that won a gold medal in the 2014 Asian Games in Incheon.",Kavita  kabaddi  born 1993 ,248
"Croixsyde

Croixsyde is a historic house in May Township, Minnesota, United States, near the city of Stillwater. It was built from 1922 to 1927 as one of the first summer homes on the St. Croix River. It was listed on the National Register of Historic Places as the Benjamin B. Sheffield House in 1980 for its local significance in the themes of architecture and entertainment/recreation. It was nominated for being an early example of the area's summer homes and for its fine rustic architecture.",Croixsyde,249
"Tytus Kanik

Tytus Kanik is a Polish darts player who currently plays in Professional Darts Corporation events
Kanik first made our screens in the 2015 PDC World Cup of Darts, pairing up with Mariusz Paul, and they lost to the Irish pairing of William O'Connor and Connie Finnan 5-0, barely averaging 70.

He played in the 2017 PDC World Cup of Darts campaign, teaming up with Polish captain Krzysztof Ratajski where again lost the Republic of Ireland duo consisting of O'Connor and Mick McGowan where Poland lost 5-3. 
Even though Poland lost, Kanik did play his part by hitting 324 in 6 darts.

https://www.mastercaller.com/players/tytus-kanik

https://m.youtube.com/watch?v=7vX7FIM1qi4",Tytus Kanik,250
"2017–18 Columbia Lions women's basketball team

The 2017–18 Columbia Lions women's basketball team represents Columbia University during the 2017–18 NCAA Division I women's basketball season. The Lions, led by second year head coach Megan Griffith, play their home games at Levien Gymnasium and are members of the Ivy League.

They finished the season 13–14, 3–11 in Ivy League play to finish in a tie for seventh place.

!colspan=9 style=| Non-conference regular season
!colspan=9 style=| Ivy League regular season
!colspan=9 style=| Ivy League Women's Tournament",2017–18 Columbia Lions women s basketball team,251
"Goodbye Leonard

Goodbye Leonard (French: Adieu Léonard) is a 1943 French comedy film directed by Pierre Prévert and starring Charles Trenet, Pierre Brasseur and Julien Carette. The future star Simone Signoret had a small role in the film.

The film's sets were designed by the art director Max Douy. It was shoat the Francoeur Studios in Paris. It was distributed by Pathé, one of France's largest film companies.",Goodbye Leonard,252
"Vilhelms

Vilhelms is a Latvian masculine given name. The diminutive form of Vilhelms is Vilis. People bearing the name Vilhelms include:",Vilhelms,253
"List of Official Albums Streaming Chart number ones of 2018

The Official Albums Streaming Chart is a weekly music chart in the United Kingdom which calculates the most popular albums on audio streaming sites.",List of Official Albums Streaming Chart number ones of 2018,254
"Lantern minnow

The lantern minnow (""Tampichthys ipni"") is a species of cyprinid fish endemic to Mexico.",Lantern minnow,255
"Avenell Heights, Queensland

Avenell Heights is a suburb of Bundaberg in the Bundaberg Region, Queensland, Australia.

The North Coast railway line forms the western boundary of the suburb. The suburb is flat land used almost entirely for residential purposes with the exception of the Bundberg Racecourse in the north-west of the suburb.",Avenell Heights  Queensland,256
"Lucia Mee

Lucia Quinney Mee BEM (born c. 1999) is a Northern Irish campaigner for organ donation, having had three liver transplants herself, the first at the age of eight. She took part in the 2016 Transplant Games. She started the Live Loudly Donate Proudly campaign.",Lucia Mee,257
"1995–96 FC Basel season

The 1995–96 Fussball Club Basel 1893 season was their 102nd season since the clubs foundation. Peter Epting was the clubs chairmann for the forth period. FC Basel played their home games in the St. Jakob Stadium. Following their promotion in the 1993–94 season this was their second season back in the highest tier of Swiss football.

Karl Engel was appointed as trainer, following Claude Andrey. The clubs priority aim was to remain in the top flight of Swiss football. The club made some new signings as the season started, these included Ike Shorunmu (Nigerian national team goalkeeper), Gabriel Okolosi, Alex Nyarko and David Orlando.",1995–96 FC Basel season,258
"Guo Gan

Guo Gan (; born November 15, 1968) is an erhu musician from Shenyang, China now based in Paris, France. Gan was recognized as a Knight of the Order of Arts and Letters in 2016.

Gan started to learn the erhu at the age of four, and was taught by his father, Guo Junming. Guo Gan moved to Paris, France in 2000, and obtained a Master's degree in percussion from the National Music School of Fresnes. 

Gan has performed at Carnegie Hall with Lang Lang and with Didier Lockwood at the Jazz à Juan in 2016.

Gan also plays with Mathias Duplessy and the Three Violins of the World with Alicia Régnard, Naranbaatar Purevdorj and Zied Zouari.

Gan was a featured player on the Kung Fu Panda 3 soundtrack.",Guo Gan,259
"Orwell Site (Fergus Falls, Minnesota)

The Orwell Site, designated 21OT7 in the state archaeological inventory, is a historic site located near Fergus Falls, Minnesota, United States. It consists of twelve Middle or Late Woodland period burial mounds, four of which are enclosed by an earthwork. They were built from about A.D. 350-600. They share similarities with the mounds found at Fort Juelson, also in Otter Tail County, with their central burial chamber. The site was listed on the National Register of Historic Places in 1974.",Orwell Site  Fergus Falls  Minnesota ,260
"Blackstripe minnow

The blackstripe minnow (""Tampichthys rasconis"") is a species of cyprinid fish endemic to Mexico.",Blackstripe minnow,261
"2017–18 Penn Quakers women's basketball team

The 2017–18 Penn Quakers women's basketball team represents the University of Pennsylvania during the 2017–18 NCAA Division I women's basketball season. The Quakers, led by ninth year head coach Mike McLaughlin, play their home games at the Palestra and are members of the Ivy League.

The team was picked by the Ivy League in the pre-season to be conference champions. finished the season 22–8, 13–1 to win the Ivy League regular season title and their first ever Ivy League Tournament to earn an automatic trip to the NCAA Women's Tournament, which they had a 21 point lead before losing to Texas A&M in the first round.

!colspan=8 style=| Regular season
!colspan=9 style=| Ivy League Women's Tournament

2017–18 NCAA Division I women's basketball rankings",2017–18 Penn Quakers women s basketball team,262
"BambooHR

BambooHR is an American technology company that provides human resources software as a service. Founded in 2008 by Ben Peterson and Ryan Sanders, the company is based in Lindon, Utah.

BambooHR has an ""anti-workaholic policy"" in which management prohibits employees from working more than 40 hours in a week and fired one employee for violating their policy by working too much.

BambooHR's services include an applicant tracking system and an employee benefits tracker. Juan Martinez and Rob Marvin wrote in ""PC Magazine"" in 2017 that although the website is ""easy to get up and running"", it is more expensive than a large number of its competitors and its website is ""pretty but lacks functionality"".

BambooHR was founded in 2008 by Ben Peterson and Ryan Sanders. Based in Lindon, Utah, the company has a dancing panda mascot. BambooHR had 200 employees in September 2016. In 2016, BambooHR served 5,000 clients that were based in 100 countries. BambooHR customers in 2017 included Shopify, Foursquare, and Reddit.

Most of BambooHR's employees are salaried employees and do not qualify for overtime. BambooHR has an ""anti-workaholic policy"" in which employees are forbidden from laboring over a 40-hour week. Company co-founder Ryan Sanders' rationale was that occupational burnout has a detrimental effect on the health of his employees and negatively affects their families and his company. He started taking this view during his organizational leadership studies as a graduate student at Gonzaga University.

BambooHR started a ""paid paid vacation"" policy in 2015. Employees who have worked at BambooHR for at least six months are eligible for $2,000 in reimbursements for vacation expenses like airline tickets, hotel rooms, and other tourist activities. Joe Fryer profiled BambooHR's vacation policy on the ""Today"" show on September 16, 2016. According to a 2015 article in ""The Wall Street Journal"", BambooHR terminated an employee for violating their workweek policy by working more than 40 hours.

BambooHR provides companies a human capital management software as a service. The service has a dashboard homepage with different sections for employee information, vacation time recordkeeping, and reports. The sections are: ""My Info"", ""Employees"", ""Job Openings"", ""Reports"", and ""Files"". The dashboard also contains an employee's image, contact details, and vacation time remaining. It has areas that show scheduled lessons and business communications. Users can see their coworkers' birthdays and scheduled time off.

BambooHR's software includes an applicant tracking system. The system has a catalogue of job opportunities and data about each opportunity including the hiring manager, how many people have applied, and how long it has been posted. BambooHR's integration allows job openings to be posted at the same time to the company's jobs page and to career sites like Glassdoor.

BambooHR allows companies to record employee benefits. It includes reports that help employees fill out Affordable Care Act compliance forms. In 2017, Juan Martinez and Rob Marvin wrote in ""PC Magazine"" that BambooHR's benefits administration functionalities are inferior to Zenefits'. It also has a performance review feature. It provides an open API to allow combination with other HR software services. In 2017, it started BambooHR Marketplace to allow software developers to market HR apps they have integrated with BambooHR.

Juan Martinez and Rob Marvin wrote in ""PC Magazine"" in 2017 that although the website is ""easy to get up and running"", it is more expensive than a large number of its competitors and its website is ""pretty but lacks functionality"".",BambooHR,263
"Billy Nealon

Billy Nealon (born November 11, 1960) is a former professional tennis player from the United States.

A left-handed player from Rochester, New York, Nealon played collegiate tennis at the University of Southern California, while studying for a degree in business administration. 

Nealon competed in both the men's singles and doubles main draws at the 1980 US Open. In the singles he came up against ninth seed Peter Fleming in the first round and was beaten in four sets. His career was hampered by a knee injury, which required surgery in 1982 and kept him off the tour until 1984. Reaching a ranking of 156 in doubles, he was a doubles quarter-finalist at Geneva in 1984 and finished runner-up in the doubles at the 1985 Thessaloniki Challenger.

He is a member of the Rochester Tennis Hall of Fame and still lives in the area, working as a tennis coach.",Billy Nealon,264
"Estonia at the Deaflympics

Estonia has been participating at the Deaflympics since 1993 and has earned a total of 32 medals.",Estonia at the Deaflympics,265
"Rohan Oza

Rohan Oza is an American businessman, investor, and well known marketing expert behind several large brands. Oza began his career at age 20 as the manufacturing manager behind Mars' M&M's, and then later became the youngest manager to run the Snickers brand.

After working for Mars, Oza began a career at The Coca-Cola Company where he revived the Powerade and Sprite (drink) brands using innovative methods. 

After resigning from Coca-Cola in 2002, Oza left to be a partner in Vitamin Water, doing business as Glacéau, whose sales at the time hovered around $25 million. More innovative marketing and celebrity partnerships, fostered by Oza's leadership, grew the Vitamin Water and Smartwater brands. By using celebrities such as 50 Cent, Jennifer Aniston, LeBron James, and Tom Brady, Oza was able to grow the fledgling brands.

In 2007, Coca-Cola purchased Glacéau in an acquisition for $4.2 billion expanding the company's non-carbonated portfolio. Rohan was appointed Chief Marketing Officer of Coke's still brands, returning to the company after the acquisition.

In Season 9 of Shark Tank, Oza appeared as a guest ""shark"".",Rohan Oza,266
"Honor Guard Company of the Ministry of Defense of Kazakhstan

The Honor Guard Company of the Ministry of Defense of Kazakhstan (Kazakh:Қазақстан Республикасы Қорғаныс министрлігінің Құрмет грамотасы, Russian:роты почетного караула Министерства обороны Республики Казахстан) is a Honor guard unit of the Ministry of Defense of Kazakhstan.

It was founded in 2002, by order of then defense minister Mukhtar Altynbayev. Since its formation, the company has taken part in all ceremonies and events in Kazakhstan and also abroad. Among the events the company has taken part in is, the Inauguration of the President of Kazakhstan, Victory Day, Independence Day and Defender of the Fatherland Day parades, and the 2010 Moscow Victory Day Parade and the 2015 China Victory Day Parade.",Honor Guard Company of the Ministry of Defense of Kazakhstan,267
"2017–18 Cornell Big Red women's basketball team

The 2017–18 Cornell Big Red women's basketball team represents Cornell University during the 2017–18 NCAA Division I women's basketball season. The Big Red, led by sixteenth year head coach Dayna Smith, play their home games at Newman Arena and are members of the Ivy League.

They finished the season 16–11, 7–7 in Ivy League play to finish in a tie for fourth place.

!colspan=9 style=| Non-conference regular season
!colspan=9 style=| Ivy League regular season
!colspan=9 style=| Ivy League Women's Tournament",2017–18 Cornell Big Red women s basketball team,268
"Quiet Is Violent Tour

The Quiet Is Violent Tour is Twenty One Pilots second headlining tour as a signed band under Fueled by Ramen. The tour ran from September to November 2014.

Note that this setlist is a representative of the average setlist for the duration of the tour, and is therefore not representative of ""all"" tour dates.",Quiet Is Violent Tour,269
"Love, Death and the Devil

Love, Death and the Devil (German: Liebe, Tod und Teufel) is a 1934 German drama film directed by Heinz Hilpert and Reinhart Steinbicker and starring Käthe von Nagy, Albin Skoda and Brigitte Horney. It is based on Robert Louis Stevenson's story ""The Bottle Imp"".

The film's sets were designed by the art director Otto Hunte and
Willy Schiller. The following year UFA's French subsidiary released a French-language version of the film ""The Devil in the Bottle"".",Love  Death and the Devil,270
