content,title,id
"Arco de Santa María

Arco de Santa María in Burgos correspond to one of the 12 medieval doors the city had during the middle ages. It was rebuilt by Charles V, Holy Roman Emperor during the XVI century after the local rulers of the city supported him during the Revolt of the Comuneros. In the outdoors of the arc appear relevant people for the city of Burgos and Castile, as Diego Rodríguez Porcelos, founder of the city, Jueces de Castilla Laín Calvo and Nuño Rasura, El Cid, Fernán González and the own Charles V.",Arco de Santa María,485
"P. Ellis Eyton

Peter Ellis Eyton (1827 - 19 June 1878) was a Liberal Party politician. 

He was elected Liberal MP for Flint Boroughs in 1874, but died in 1878 after four years in office.",P  Ellis Eyton,486
"Saudi Arabia–Tunisia relations

Saudi Arabia–Tunisia relations refers to the bilateral relations between Saudi Arabia and Tunisia.

Two countries share historical commons, as both are majority Sunni Muslims and their Arabic heritages. Despite of this, Saudi Arabia and Tunisia nonetheless have political differences. Saudi Arabia is a conservative Kingdom while Tunisia is a liberal Republic. However, two countries have engaged in larger cooperations in order to exert Saudi influence.

Saudi Arabia has en embassy in Tunis, whilst Tunisia maintains embassy in Riyadh and a consulate in Jeddah.

The Arab conquest at 7th century had brought Tunisia into an Islamic sphere. A mosque, which is regarded as the third holiest place in the Islamic world, the Great Mosque of Kairouan, was built in Tunisia.

Both two nations have increased significant cooperation since the independence of Tunisia from France. The Saudi Kingdom has attempted to increase their Islamic doctrine into Tunisia for several years recently.

After the Tunisian Revolution in 2011, which ousted President Zine El Abidine Ben Ali, Saudi Arabia has granted asylum for Zine Ben Ali, who himself is a long time friend for the Saudis, while supports Tunisia on their track of recovery. Nonetheless, new Tunisian Government has shown unhappiness towards Saudi Arabia's decision to grant Ben Ali's asylum and has demanded the Saudi Government to extradite back to Tunisia for trials.",Saudi Arabia–Tunisia relations,487
"Cannabis in the Bahamas

Cannabis is illegal in the Bahamas.

The Bahamas role as a transit country for cannabis is noted as beginning in 1968, when 300 pounds of cannabis were flown from Jamaica to Bimini. As recently as 2010 the country was noted as a mid-point for Jamaican cannabis being smuggled to the United States.

Historically the Bahamas was a drug trafficking country, but not a drug producing one, until a 1991 seizure of 40,000 cannabis seedlings and 1,000 adult plants on Andros Island called that assumption into question.",Cannabis in the Bahamas,488
"Ghostly Desires

Ghostly Desires is a critically panned and very rare 1995 erotic/sexual FMV adventure video game developed by CPV Productions and published by Spice Interactive.

Just Adventure negatively compared the game to ""Phantasmagoria, Kama Sutra, Druuna Morbis, Riana Rouge and Erotica Island,"" describing it as a ""blatant rip-off"" of ""7th Guest"" with nude staff, where players walk from one porn scene to another; the reviewer ultimately gave the game an F rating. Quandaryland had similar sentiments, describing the game as an excuse to watch porn, giving it half a star.",Ghostly Desires,489
"Clay Faulkner House

Faulkner Rest is a historic house in Warren County, Tennessee, U.S.. It was built in 1896-1897 for Clay Faulkner, the son of politician and mill owner Asa Faulkner, who lived at Falconhurst. Faulkner lived in the house with his wife, Mary King Saunders, and their five children. He was the owner of the Great Falls Cotton Mill. From 1929 to 1941, the house was owned by Dr. Herman Reynolds, who welcomed patients into his home. McMinnville Mayor W. V. Jones was the owner from 1943 to 1945. It later used as a hospital, until it was remodelled as a private residence by the Grissoms and the McGlothins in the 1980s.

The house was designed in the Queen Anne architectural style. It has been listed on the National Register of Historic Places since March 5, 1992.",Clay Faulkner House,490
"2018 Brisbane International – Men's Doubles

Thanasi Kokkinakis and Jordan Thompson were the defending champions, but Kokkinakis chose to compete in the Hopman Cup instead. Thompson played alongside Lleyton Hewitt, but lost in the first round to Grigor Dimitrov and Ryan Harrison.

Henri Kontinen and John Peers won the title, defeating Leonardo Mayer and Horacio Zeballos in the final, 3–6, 6–3, [10–2].",2018 Brisbane International – Men s Doubles,491
"2018 Shenzhen Open – Doubles

Andrea Sestini Hlaváčková and Peng Shuai were the defending champions, but Sestini Hlaváčková chose to compete in Brisbane instead and Peng chose not to participate this year.

Irina-Camelia Begu and Simona Halep won the title, defeating Barbora Krejčíková and Kateřina Siniaková in the final, 1–6, 6–1, [10–8].",2018 Shenzhen Open – Doubles,492
"Algeria–Mali relations

Algerian–Malian relations refer to the relationship between Algeria and Mali. Algeria maintains an embassy in Bamako and a consulate in Gao, while Mali has en embassy in Algiers.

The relationship between two countries, once former colonies of France, both share the Sahel desert as border, and also having a very long border, has made the relationship become a major obstacle for both two neighboring states. As two majority Sunni Muslim countries, recent instability in Mali, notably the Azawad of the Tuareg people has poured a large presence of al-Qaeda in the Islamic Maghreb and it has pushes Algeria into a difficult situation. To retaliate, Algeria fortified their border and deployed more troops to secure the border with Mali. The fear of growing militants from Mali brings Algeria and the United States to discuss on how to curb their extremist actions

Malian immigrants has formed at least 1% of Algerian population, and most live in coastal cities such as Oran, Constantine and Algiers, although Malians sometimes live in the South, notably in Tamanrasset and Adrar Provinces.

Algeria and Mali have been going further to diversify economic cooperation. Algeria has been a major investor to Mali, economically due to Algeria's economic progress and lesser poverty comparing to Mali.",Algeria–Mali relations,493
"Minmose

Minmose was an ancient Egyptian personal theophoric name. Some notable bearers were:",Minmose,494
"Hundred of Waroonee

The Hundred of Waroonee is a hundred of the County of Herbert, South Australia, founded in 1880.",Hundred of Waroonee,495
"Bradish

Bradish is a surname. Notable people with the surname include:",Bradish,496
"Bàsquet Girona

Club Bàsquet Girona 2014 is a Spanish basketball club based in Girona, Catalonia that was founded in 2014 by NBA player Marc Gasol.

The club was founded in 2014 by NBA player Marc Gasol, that previously played in CB Girona between 2006 and 2008, with the name of Club Escola Bàsquet Marc Gasol. In its first years the club only competed in youth categories.

In 2016, it added the name of the city of Girona to the name of the club thus becoming CEB Girona Marc Gasol and one year later, it changed again its name to simply Bàsquet Girona.

Also in 2017, and with the aim to become the main men's basketball club in the city, the club created the senior squad that would start competing in the fourth tier, Liga EBA, after achieving a vacant spot in the league. Quim Costa would be the head coach for the debut season.",Bàsquet Girona,497
"Minburra, South Australia

Minburra is a rural locality in the Australian state of South Australia located about north of the state capital of Adelaide and about north-east of the municipal seat in Orroroo.

Land use within the locality is ’primary production’ and is concerned with “agricultural production and the grazing of stock on relatively large holdings.
It is in the County of Herbert and is located within the federal division of Grey, the state electoral district of Stuart and the local government area of the District Council of Orroroo Carrieton .",Minburra  South Australia,498
"Solberga

Solberga may refer to:",Solberga,499
"Trev's Perfection

Trev's Perfection was a famous racing greyhound from the 1940s. He is just one of three greyhounds along with Patricias Hope and Mile Bush Pride to win the Triple Crown which consisted of the English Greyhound Derby, Scottish Greyhound Derby and Welsh Greyhound Derby.

He was born in Cumberland with the name of Motts Regret in April 1944. By Trev's Dispatch out of Friar Tuck he was bred and reared by Mr H.G. Nunn. He competed in the 1946 English Greyhound Derby without success. Later that year he went down with distemper and pneumonia at the GRA kennels in Northaw and after a long convalescence recovered successfully.

In 1947 Motts Regret was bought by Fred Trevillion, a haulage contractor from Dartford, who was a National Greyhound Racing Club licensed greyhound trainer with a number of greyhounds which carried the Trev's prefix. He paid £900 to purchase Motts Regret and changed the dogs name to Trev's Perfection.

He won the Circuit competition at Walthamstow Stadium and later on 7 June 1947 he defeated the final field, which included Mondays News, to lift the Gold Collar title before heading for the Derby.

Before an attendance of 55,000 he won the 1947 English Greyhound Derby. The triple crown was achieved by virtue of winning the Scottish Greyhound Derby on 5 July and Welsh Greyhound Derby on 26 July.

On 1 April 1948 Fred Trevillion, his head kennel-man Arthur Hancock and Trev's Perfection left on the Queen Mary for the United States where the greyhound failed to make an impression. They returned to the United Kingdom and Trev's Perfection was retired to stud in 1948.",Trev s Perfection,500
"2018 Maharashtra Open – Doubles

Rohan Bopanna and Jeevan Nedunchezhiyan were the defending champions, but lost in the quarterfinals to Pierre-Hugues Herbert and Gilles Simon.

Robin Haase and Matwé Middelkoop won the title, defeating Herbert and Simon in the final, 7–6, 7–6.",2018 Maharashtra Open – Doubles,501
"Integra Connect

Integra Connect is a healthcare technology company focused on oncology and urology practice, as well as emergency medicine companies and the broader life sciences industry. 

Integra Connect was founded in 2015 by Raj Mantena and a team of healthcare executives following the passage of the Medicare Access and CHIP Reauthorization Act of 2015. Integra Connect announced itself more publicly at the HIMSS 2017 conference in February of 2017 and has 1,400 employees in 10 offices worldwide.

In 2017, it was announced that Innovative Oncology Business Solutions' Community Oncology Medical Home program triage pathways would be integrated into Integra Connect's Oncology Care Model and population health technologies.

In 2016, the Large Urology Group Practice Association partnered Integra Connect to develop advanced alternative payment models specific to urology, with an initial focus of value-based prostate cancer care.",Integra Connect,502
"Dora Fabian

Dora Fabian (1901–1935) was a German socialist and anti-Nazi activist.

She was the daughter of Else Levy Heinemann and a socialist lawyer who defended Trade Unionists and political activists in court. This environment nurtured her interest in politics and during the First World War she became a member of the Independent Social Democratic Party of Germany.

In 1924 she married Walter Fabian a fellow social democratic activist.

She became disillusioned with the politics of the Social Democratic Party of Germany and joined the Socialist Workers' Party of Germany.

After being detained by the Nazis in March 1933, she decided to leave Germany than risk re-arrest. She fled first to Prague, then Paris, finally arriving in London on 8 September 1933. She had an invitation from John Paton a leading figure in the Independent Labour Party. She had sufficient funds to be allowed to stay for a month with the previso she did not work.

She was found dead alongside Mathilde Wurm in their London flat in Guilford Street on 4 April 1935. The inquest attracted a great deal of interest and was attended by Fenner Brockway, James Maxton, Ben Riley as well as by Ernst Toller, who travelled from Paris to attend. Karl Korsch was a witness, having been in a relationship with Fabian. Indeed he had ended the relationship and this was used as an argument to suggest that Fabian was suffering from depression. When the verdict came it was that the two women had ""committed suicide while of unsound mind"". However, this was not accepted by many members of the German anti-Nazi refugee community or their British supporters.

This incident features in the novel ""All That I Am"" by Anna Funder.",Dora Fabian,503
"Dora Saker

Dora Glover Saker (1888 - 1 July 1926) was an instructor in cheese-making for Somerset County Council. The rediscovery of her book, ""Practical Cheddar Cheese-making"" (1917), by cheese-makers in the twenty-first century has been credited with inspiring a revival of interest in historic cheese-making methods and to have ""quickly acquired cult status amongst farmhouse cheese-makers"".

Dora Saker was born in Redhill, Surrey, England, in 1888, to Richard Webb Saker, a solicitor's clerk, and his wife Hannah C. Saker. She had two sisters and two brothers.

Bronwen Percival and Randolph Hodgson describe Saker as working during a period when methods of dairy production were becoming more scientific with farmers, colleges and instructors co-operating to ensure that local cheese producers were able to make a consistently high-quality product.

In 1908 Saker passed the examinations of the National Agricultural Examination Board and was awarded the National Diploma in Dairying (NDD). She also qualified as BDFD. She was appointed as an instructor in cheese-making for Somerset County Council and in 1917 published her first book, ""Practical Cheddar Cheese-making"" which emphasised the importance of good hygiene and the correct alignment of acidification with moisture loss in the production process. She advocated farmhouse over factory production as in her view the former allowed a better control to be kept over the quality of the ingredients and the making process. In 1919 she was appointed cheese examiner at Chelmsford, and in 1920 she was appointed examiner in cheese-making at the examinations of the British Dairy Farmers Association in Reading. In that year she held the position of Superintendent of Dairy Poultry and Domestic Science to the Somerset Agricultural Instruction Committee. In 1921 she published her second book, ""Practical Dairying"", in Methuen's Handbooks of Agriculture series. In 1923 she travelled to New York on the ship ""Celtic"".

Saker died at a hospital in Bridgwater, Somerset, on 1 July 1926. Her residence was recorded as The Somerset Farm Institute, Cannington, Bridgwater. She left an estate of £1,575. Probate was granted to her sisters Margaret May Saker and Ida Marion Saker.

Saker's book on Cheddar cheese-making was rediscovered in the early twenty-first century and has been credited with inspiring a revival of interest in historic cheese-making methods. According to Percival and Hodgson, the book has ""quickly acquired cult status amongst farmhouse cheese-makers"" but they caution against seeing her advice as the rediscovery of a lost traditional way of cheese-making, arguing that there is no such thing and that Saker was very progressive in her views and seeking to improve the quality of the product through the application of scientific techniques.",Dora Saker,504
"Erotica Island

Erotica Island is a 2001 X-rated video game developed by Redfire Software and published by Flare Media Limited. it was BBFC 18 Certified.

Bonus Web described the graphics as being of the manga style. The developers described the title as similar in tone and gameplay to Leisure Suit Larry.

The game was promoted by Flare Media Ltd. at an expo, with hostesses in pink dresses. The developers wanted to release the game during February 2001, ideally on Valentine's Day. The game went on sale on March 21, 2001 in Britain, and those in other countries could purchase the game online.

While Flare Media assured Bonus Web many times that they would send a demo of the game, they never did. This is often a sign that a game is poor quality. Bonus Web was only able to review the game after a community member who had bought the game sent it to them.

Originally an ""Erotica Island 2"" was planned, but this was eventually cancelled.

The player is the billionaire Reggie Rich whose plane crashes on an island. The only way to escape is on a boat. However the owner lends it for $10,000. He offers to lend it for $100 if the player seduces all the girls on the island.

Four Fat Chicks called the game ""crap"", with ""no redeeming value, social or otherwise"". Meanwhile, GamePressure gave it 3.4/10. Spong described it as a "" perverted, poor attempt"". Bonus Web criticised the game's graphics. GameCaptain gave the game a rating of 14 out of 100. Absolute Games gave the game a rating of 25%.",Erotica Island,505
"Hundred of Nuriootpa

The Hundred of Nuriootpa is a cadastral unit of hundred in the County of Light, South Australia split between in the eastern Adelaide Plains and western Barossa Valley. Named in 1847 for an indigenous term officially thought to mean ""bartering place"" and traditionally used as neutral ground for trading between various indigenous tribes, it is bounded on the south and east by the North Para River.
The town of Nuriootpa is at the north eastern corner of the hundred. Other towns within the hundred are Freeling, whose the southern and oldest parts straddle the north border of the hundred, and Greenock, also in the hundred's north. The localities of Nain, Kingsford, Shea-Oak Log, Daveyston, Seppeltsfield, Marananga, Stone Well and Gomersal as well as parts of Templers, Roseworthy, Concordia, Rosedale, Lyndoch, Rowland Flat and Tanunda are also within the hundred.

The hundred borders on the greater Adelaide conurbation with the Gawler suburb of Hewett and parts of the suburbs of Gawler East and Gawler South also lying within the hundred at the south-western corner near the North Para's confluence with the South Para River.

Apart from the very small portion of land occupied by the Town of Gawler at the south-western corner of the hundred, the earliest local government in the hundred was established in 1867 with the establishment of the District Council of Nuriootpa, spanning the remainder of the hundred. In 1892 the Nuriootpa council annexed a portion of the District Council of Light to the north-west, bringing the township of Freeling (on the hundred's north border) under the governance of a single body. In 1910 the township of Nuriootpa in the hundred's north-east corner was annexed by the District Council of Angaston but the vast bulk of the hundred remained under the governance of the Nuriootpa council. In 1918 the Nuriootpa council changed its name to Freeling in line with the location of the council seat.

In 1977 Freeling and Mudla Wirra council (to the west) were amalgamated to form the new District Council of Light (the second of that name). In 1996 the Light council amalgamated with the District Council of Kapunda (to the north) to form the present-day Light Regional Council. The Nuriootpa township portion of the hundred at the north-east corner remained under the governance of Angaston council until 1996 when Angaston was amalgamated with Tanunda and the old Barossa district councils to form the present-day Barossa Council.",Hundred of Nuriootpa,506
"Veselinka Šarić

Veselinka Šarić (Šibenik, 1971), retired Croatian female basketball player and coach.

She started playing basketball with 11–12 years in her birthplace Šibenik. As a senior, she played for Elemes from the end of 1980s till 1994, when she was pregnant with Dario Šarić.

In 2004 she was appointed as a coach of local Šibenik's women club ŽKK Vidici Dalmostan, which under her command entered Croatian Women's Basketball League. Later, she played several years for club before finishing her profesional playing career.


She is wife of Predrag Šarić and mother of Dario and Dana Šarić.",Veselinka Šarić,507
"Ellen Marx

Ellen Marx may refer to:",Ellen Marx,508
"Fire in Hell

Fire in Hell () is a 2014 South Korean drama film written and directed by South Korean indie provocateur Lee Sang-woo. Based on a true story, it made its world premiere at the 13th Jeonju International Film Festival and its international premiere at the 34th Moscow International Film Festival in 2012.

Ji-wol (Won Tae-hee), a Buddhist monk, is banished from his temple for sexual misconduct with a female devotee. He returns home, but ends up raping Yeon-seo (Cha Seung-min) and accidentally killing her. Guilt-ridden, he travels to Philippines to return Yeon-seo's ashes to her family. In a twisted moment of karma, he meets Yeon-soo's twin sister, Yeon-hwa (Cha Seung-min), and falls madly in love with her.


Next Projection's Rowena Santos Aquino : """"Fire in Hell"" is an exercise on guilt, fantasy, and desire all bound up in the notion of karma, whose form veers somewhat into the realm of experimental film. The result is superficially interesting at best and tiresome at worst.""

Knowshi Magazine's Mut Asheru: ""Lee Sang-woo's ""Fire in Hell"" is not a pretty film to watch. But it is interesting...""",Fire in Hell,509
"Killingsworth (surname)

Killingsworth is a surname. Notable people with the surname include:",Killingsworth  surname ,510
"Killingsworth

Killingsworth may refer to:",Killingsworth,511
"UpGrad

UpGrad is an online education platform cofounded by Indian entrepreneur and philanthropist Ronnie Screwvala, along with Mayank Kumar, Ravijot Chugh and Phalgun Kompalli, based in Mumbai, India.
UpGrad was founded by Mayank Kumar, Ronnie Screwvala, Ravijot Chugh and Phalgun Kompalli. Mayank Kumar is the MD and CEO of UpGrad. He is an Indian Institute of Technology Delhi and Indian School of Business alumnus.

UpGrad was launched with an investment of Rs.100 crore and offers online courses in entrepreneurship, marketing, data, product, software and management for working professionals.

Ronnie Screwvala is the chairman of UpGrad. Ravijot Chugh is an IIT-Delhi Alumnus and he heads the Product Team at UpGrad, he had co-founded a social travel startup 36hr.in before this. Phalgun Kompalli also an IIT-Delhi Alumnus, heads the Sales, Marketing and Operations Team at UpGrad.

UpGrad's first program was ""Start-Up with UpGrad"", an entrepreneurship program. The second program, Data Analytics was in collaboration with International Institute of Information Technology, Bangalore. Uber and Gramener have helped to develop case studies and projects in their Data Science course. 

In the third quarter of 2016, they launched two more programs - Product Management and Digital Marketing. For the Digital Marketing Program they tied-up with Unmetric, HubSpot Academy and with MICA. In early 2017, UpGrad launched an online Entrepreneurship program in collaboration with Invest India and Startup India, a Government of India initiative. They held various career weeks and learning weeks; they also launched UpGrad Xchange in Bangalore, India. 

Recently, UpGrad has launched more programs like Big Data, Machine Learning and Artificial Intelligence, Digital Marketing Strategies, Management and Software Development by partnering with universities like Cambridge University, BITS Pilani, IMT Ghaziabad and International Institute of Information Technology, Bangalore. 

They also organised UpGrad Talks to host Nandan Nilekani and DJ Patil in its first edition in August 2017. In the second edition of UpGrad Talks which was organized in December 2017, they partnered with The Indian Express and hosted Manish Sabharwal, Rishad Premji, who were in talks with Ronnie Screwvala and Shaji Vikraman.",UpGrad,512
