content,title,id
"Morocco–Saudi Arabia relations

Moroccan–Saudi Arabian relations refers to the current and historical relations between Morocco and Saudi Arabia. Morocco has an embassy in Riyadh and Saudi Arabia has an embassy in Rabat.

Both two nations have a long and traditional friendly relations based on many historical commons. Both Morocco and Saudi Arabia are two monarch states ruled by respective families, the Alaouites and the Al-Sauds, adhere to Sunni Islam, fear of growing Iranian and Shiite influence and their relationship is mostly described as excellent.

Morocco and Saudi Arabia have together taken steps to curb Iranian influence in the Arab world, although Morocco has a moderate approach to Iran while Saudi Arabia is more cautious and hostile of Iran.

Saudi Arabia has recently supported Morocco over the dispute of Western Sahara and doesn't recognize the legitimacy of Sahrawi Arab Democratic Republic, through the Arab League. Saudi Arabia, on the other side, also helps funding several projects in the region with support from Moroccan authorities.

During the current Yemeni Civil War, Morocco participates as part of the anti-Houthi coalition led by Saudi Arabia, with 6 planes and 1,500 troops.

Morocco has taken neutral stance in the conflict, hoping for a better resolution that benefit Qatar and Saudi Arabia, the former had participated together with Morocco in anti-Houthi campaign. Morocco even offers to act as a mediator to slow the tensions between two Gulf Arab states.",Morocco–Saudi Arabia relations,1
"Anthony United States Post Office

The Anthony United States Post Office, listed on the National Register of Historic Places as US Post Office--Anthony, is located at 121 W. Steadman in Anthony, Kansas. It was built in 1939. It was listed on the National Register in 1989.

It was deemed significant ""for its historical association with the Treasury Department's Section program and for the artistic significance of the mural that it contains. The mural, ""Turning a Corner"", was painted by St. Louis artist Joe Jones (1901-1963) in 1939 and depicts three farmers using a combine to thresh wheat.",Anthony United States Post Office,2
"Dumraon (Vidhan Sabha constituency)

Dumraon Vidhan Sabha constituency is one of 243 legislative assembly of legislative assembly of Bihar. It is comes under Buxar lok sabha constituency.

Dumraon comprises Community Blocks of Chaugain, Kesath & Nawanagar; Gram Panchayats of Chilhari, Kushalpur, Bhojpur Kadim, Bhojpur Jadid, Chhatanwar, Nuaon, Sowan, Ariaon, Nandan, Lakhan Dihra & Dumraon (M) of Dumraon CD Block.",Dumraon  Vidhan Sabha constituency ,3
"Chaker Khazaal

Chaker Khazaal (born 28 September 1987 in Beirut, Lebanon) is a Palestinian-Canadian author and reporter born to Palestinian filmmaker Mahmoud Khazaal and socio-political activist mother Olfat Mahmoud. Khazaal grew up in Bourj el-Barajneh refugee camp near Beirut and at a young age, participated in several local plays and starred in the Palestinian film ""Sugar of Jaffa"". He is a third generation Palestinian refugee. He later immigrated to Canada and studied at York University as a 2005 recipient of the Global Leader of Tomorrow Award. He graduated in 2009 from York University with a B.A. in International Development Studies.

Khazaal was named number one in the 100 Most Influential Arabs Under 40 by ""Arabian Business"" Magazine. 

""Confessions of a War Child"" is a thriller romantic trilogy of fiction written by Khazaal inspired by true stories of war children around the world. The first part was published in 2013, under the main title followed by the second installment, subtitled ""Lia"" in 2014 and third part of the trilogy subtitled ""Sahara"" in 2015. In 2017, he published the novel ""Tale of Tara"" about the story of a Palestinian refugee from a camp in Lebanon to human traffickers in Europe where she becomes a prostitute and her meeting a bestselling New York writer and the intriguing relation between the two.

Chaker writes in the ""Huffington Post"" about various topics, mainly related to the Middle East and refugees. and speaks about refugee issues on mainstream media. He dedicated his ""Esquire"" Man of the Year Award to Aylan Kurdi, the Syrian refugee child who was found dead on a beach in Turkey. Khazaal founded a program that offers refugees and migrants contractual remote employment in e-marketing, graphics, social media management and web development. In December 2016, New York based NGO Bridges of Understanding awarded Khazaal the Global Trailblazer alongside Arianna Huffington. He served as the the Editor in Chief of StepFeed and YallaFeed online news site in 2017.",Chaker Khazaal,4
"Vicente Pascual Pastor

Vicente Pascual Pastor (Alcoy, june 3, 1865 - Alcoy, february 2, 1941) was a spanish architect, one of the main architects of the Art Nouveau in Alcoy and the Valencian Art Nouveau.

Vicente Pascual Pastor was formed in the Barcelona School of Architecture and again in his natal city, in 1891 he becomes municipal architect of Alcoy. He alternates this work with the teaching in the School of Arts and Alcoy's Trades, of which he will be the director in 1903. 

Between 1909 and 1913 he becomes mayor of the Alcoy town hall. As a mayor he stimulated the construction of houses for workers in modern and healthy conditions. Inside the social and industrial life of the city, he was present in Alcoy's Savings Bank and in the institution Alcoy's Industrial Circle. He married in 1916 with Elena Perez, who had descent.

The art nouveau style of Vicente Pascual will have a few exuberant characteristics and a direct influence of the french and belgian art nouveau. 

The great majority of the projects realized by Vicente Pascual were built in Alcoy, being more than 60 the works that he realized along his life. He realized also some interesting works in Bocairent (Valencia) and Banyeres de Mariola (Alicante).

Relation of works by chronological order:",Vicente Pascual Pastor,5
"List of Swiss football transfers winter 2017–18

This is a list of Swiss football transfers for the 2017–18 winter transfer window by club. Only transfers of clubs in the Swiss Super League are included.

In:

Out:

In:

Out:

In:

Out:

In:

Out:

In:

Out:

In:

Out:

In:

Out:

In:

Out:

In:

Out:

In:

Out:",List of Swiss football transfers winter 2017–18,6
"Rajpur (Vidhan Sabha constituency)

Rajpur Vidhan Sabha constituency is one of 243 legislative assembly of legislative assembly of Bihar. It is comes under Buxar lok sabha constituency.

Rajpur comprises community blocks of Rajpur & Itarhi; Gram Panchayats Ataon, Kanjharua, Mathila, Mugaon, Kasian & Koransarai of Dumraon CD Block.",Rajpur  Vidhan Sabha constituency ,7
"Stephen E. Levinson

Stephen E. Levinson was born on September 27, 1944 in in New York City. 
He earned a B. A. degree in Engineering Sciences at Harvard University in 1966. He earned his M. S. (1972) and Ph.D. (1974) degrees in Electrical Engineering at the University of Rhode Island in Kingston, Rhode Island.

Levinson worked as a design engineer at General Dynamics from 1966-1969, after completing his Bachelor's degree, and as an instructor in computer science at Yale University from 1974-1976, after completing his Ph.D.

In 1976, he joined AT&T Bell Laboratories in Murray Hill, New Jersey. There he studied speech recognition and understanding. 
He was a visiting researcher at the NTT Musashino Electrical Communication Laboratory in Tokyo, Japan in 1979, and a visiting fellow at Cambridge University in 1984. 
In 1990, Levinson was appointed head of Linguistics Research at Bell Labs. He directed research on speech synthesis, speech recognition and the translation of spoken language.

In 1997, Levinson moved to the Department of Electrical and Computer Engineering of the University of Illinois at Urbana-Champaign, where he leads the Language Acquisition and Robotics Lab.
His areas of teaching and research include speech and language processing, speech synthesis, and language acquisition. Levinson is developing computational models of the brain, mind, and language acquisition using an iCub humanoid robot. The robot is designed to learn through experience, similar to the way in which a human child might learn. 
Levinson is the first researcher in North American to work with this type of robot, which was designed in Europe. Skills that researchers hope to teach the robot include juggling, walking, talking, and memory formation. 

Levinson has published more than 100 technical papers and holds several patents.
He is a founding editor of the journal ""Computer Speech and Language"", and an editor of the journal ""Speech Technology"".
Among others books, Levinson is the author of ""Mathematical Models for Speech Technology"" (2005) and co-author of ""Autonomous Robotics and Deep Learning"" (2014) and ""Autonomous Military Robotics"" (2014).",Stephen E  Levinson,8
"1978 Paris–Roubaix

The 1978 Paris–Roubaix was the 76th edition of the Paris–Roubaix cycle race and was held on 16 April 1978. The race started in Compiègne and finished in Roubaix. The race was won by Francesco Moser of the Sanson team.",1978 Paris–Roubaix,9
"Rajdeep Dasgupta

Rajdeep Dasgupta is a professor of Earth, Environmental, and Planetary Sciences at Rice University. In his research, he studies the role of subsurface melting and magma on the origin and evolution of the Earth and other terrestrial planets.

Rajdeep Dasgupta earned his B.Sc. in 1998 and his M.Sc. in 2000 from Jadavpur University in Kolkata, India and completed his Ph.D. in geology at the University of Minnesota in 2006. Dasgupta was a postdoctoral research associate at the University of Minnesota, and then was a postdoctoral fellow at Lamont-Doherty Earth Observatory at Columbia University. He joined the faculty of Rice University in 2008 where he is now a professor. Dasgupta also is a visiting scientist with the Lunar and Planetary Institute and an associate editor with ""Geochimica et Cosmochimica Acta"". He is a member of the American Geophysical Union, the Mineralogical Society of America, the Geochemical Society, and the Geological Society of America.

In 2011, Dasgupta received the F.W. Clarke Medal from the Geochemical Society, an award given to an early-career scientist for a single outstanding contribution to geochemistry or cosmochemistry. The American Geophysical Union awarded him the James B. Macelwane Medal in 2014. In 2012, he won the Hisashi Kuno award, given annually to an AGU member who has made outstanding contributions to the fields of volcanology, geochemistry or petrology.

Rajdeep Dasgupta is an expert on the deep carbon cycle and his research centers on how carbon, oxygen, and hydrogen in the mantle affect magma melting processes. He has created new models for how rocks melt in carbon-rich environments and calculated carbon’s solubility in the core. Dasgupta has developed a way to use major elements in magmas to estimate their source region and composition in the mantle. He also is researching sulfur solubility, to understand sulfur transport in subduction zones.",Rajdeep Dasgupta,10
"1986 Virginia Slims of Oklahoma

The 1986 Virginia Slims of Oklahoma was a women's tennis tournament played on indoor hard courts at the Summerfield Racquet Club in Oklahoma City, Oklahoma in the United States and was part of the 1985 Virginia Slims World Championship Series. It was the inaugural edition of the tournament and ran from February 24 through March 2, 1986. Fifth-seeded Marcella Mesker won the singles title.

 Marcella Mesker defeated Lori McNeil 6–4, 4–6, 6–3

 Marcella Mesker / Pascale Paradis defeated Lori McNeil / Catherine Suire 2–6, 7–6, 6–1",1986 Virginia Slims of Oklahoma,11
"Say Man

""Say Man"" is a song by American musician Bo Diddley. Written under his real name of Ellas McDaniel, it was recorded by Bo Diddley in 1959 and released as a single on Checker 931. 

The recording became his biggest US pop hit, reaching number 20 on the Hot 100, and number three on the R&B chart. It arose from a jam session between Diddley and his maracas player Jerome Green, and featured Diddley and Green trading insults. 

Bo Diddley said of the song: ""A lot of the things I did in the Chess studios, we were just goofin' around... They played it back, and it shocked all of us! Of course, they cut out all the dirty parts."" Music critic Maury Dean, while rejecting the idea that the track is ""the first rap song"", says that it is ""the first major soul tune to feature a total spoken patter of pal put-downs to a rockin' beat... Bo's lightning right hand chops chords like sugar cane. The incessant beat throbs into the hot American evening nocturne of streetwise savvy. Rap - with a side of ghetto-blast humor.""

The recording also appeared on the album ""Go Bo Diddley"".",Say Man,12
"Church of the Holy Trinity, Binegar

The Anglican Church of the Holy Trinity, Binegar, Somerset, England is Norman but has been rebuilt and restored several times since. It is a Grade II* listed building.

The original church was Norman however it was largely rebuilt in the 15th century with just the original tower remaining. A Victorian restoration was carried out in 1858.

The need for ongoing maintainence of the joists of the floor and slates on the roof mean the building has been added to the Heritage at Risk Register.

The parish is part of the benefice of Ashwick with Oakhill and Binegar, which is within the Diocese of Bath and Wells.

The stone building has an asbestos slate roof. It consists of a three-bay nave, two-bay chancel and north transept, with an organ chamber, vestry and porch. The three-stage tower is supported by diagonal buttresses. In 1937 three new bells were added in the tower.

Inside the church is a 15th century font and Jacobean altar table. There is a white marble tablet in the church which is a memorial to men from Binegar who died in World War I and a second for the fatalities of World War II.",Church of the Holy Trinity  Binegar,13
"Bernadette Kelly

Bernadette Kelly is a senior British civil servant who has served as Permanent Secretary for the Department for Transport since 18 April 2017.

Kelly joined the Civil Service after graduating, and worked in the Department for Communities and Local Government, the Treasury, Cabinet Office and the Number 10 Policy Unit. She was a Director General at the Department for Business, Innovation and Skills from 2010 until 2015, when she became Director General for the Rail Group in the Department for Trasnport, a post she held until she was appointed Permanent Secretary for that deparmtent on 18 April 2017. Her promotion followed Philip Rutnam's move to the Home Office.

Kelly was made a Companion of the Order of the Bath in 2010.",Bernadette Kelly,14
"Jean-Pierre Coursodon

Jean-Pierre Coursodon (born 23 July 1935 in Paris) is a French critic and film historian. He is also a translator of books on cinema. He has collaborated to the magazines ""Cinéma"" (1958–1965/ 1977–1986), ""Anthologie du Cinéma"" (1966–1969), ""Film Comment"" (1973–1975), ""Cinéma d'Aujourd'hui"" (1975–1976), ""Positif"" (1987).",Jean Pierre Coursodon,15
"Bunopus crassicauda

Bunopus crassicauda, also known as the thickhead rock gecko or thick-tailed tuberculated gecko is a species of gecko endemic to Iran.",Bunopus crassicauda,16
"1979 Paris–Roubaix

The 1979 Paris–Roubaix was the 77th edition of the Paris–Roubaix cycle race and was held on 8 April 1979. The race started in Compiègne and finished in Roubaix. The race was won by Francesco Moser of the Sanson team.",1979 Paris–Roubaix,17
"Palazzo Fraccia

Palazzo Fraccia is a mansion located in the town centre of Alcamo, in the province of Trapani.

This palace was built by Agostino Fraccia, baron of Favarotta and Furni since 1697, in order to have a mansion fiiting to the new social position he had acquired from his noble family; it can certainly be considered one of the most beautiful civil buildings built in the 18th century in Alcamo.

On the Baroque style façade there are eight entrances on the ground floor: the central one is full of decorations; the portal, made with travertine, owing to the restoration of the road, has a raised bottom with simple pedestals, two capitals and a lowered arch (finely decorated at its arrises), surmounted by two brackets with leaf and fruit decorations, supporting the balcony of honour.

The portal of the balcony is also rich with baroque decorations, with two pilasters, other garnitures on both sides, ending with three masks, the biggest one in the middle; the family emblem dominates the tympanum: it is formed by a heart confixed by an arrow and surmounted by the baronial crown.

The other five balconies on the first floor are made with carved stone; the brackets are fluted and have some decorations; on the second floor there are five stone balconies, two windows and two recent balconies. 

As soon as you enter the lobby, there is an atrium: today, of the two ancient staircases, there is only the one leading to the first floor; in the late 19th century they built another staircase leading up to the second floor.

The palace is situated between the Church of Saint Nicholas of Bari (along corso 6 Aprile) and via Porta Stella, where there are two other entrances on the first floor, leading to its eight rooms with accessories, and to the ten rooms existing on the second floor.

The terrace dominates the Church, with a recent balcony which was added in the last century; during the 1950s the building has changed its ownership from the marquess Patti di Santa Rosalia to the families Manno, La Colla, Lucchese and Ippolito.",Palazzo Fraccia,18
"Chester Snow

Chester Snow (June 1, 1881 – January 13, 1970) was an American applied mathematician and physicist, known for his work on formulas for computing capacitance and inductance.

Snow was born in Salt Lake City, Utah. After attending Ogden High School and Utah Agricultural College, Snow matriculated at Harvard University in 1903 and graduated there with an A.B. in 1906. At Brigham Young University he was a professor of physics from 1906 to 1911 and a professor of mathematics from 1911 to 1912. From 1912 to 1914 he was a fellow in physics at the University of Wisconsin, where he received his Ph.D. in 1914. At the University of Idaho mathematics department he was an associate professor from 1914. In 1920 he resigned from the University of Idaho to accept a position as a physicist at the Bureau of Standards in Washington, D.C. In 1924 he was an Invited Speaker of the ICM in Toronto.",Chester Snow,19
"2017 MBC Entertainment Awards

The 2017 MBC Entertainment Awards () presented by Munhwa Broadcasting Corporation (MBC), took place on December 29, 2017 at MBC Public Hall in Sangam-dong, Mapo-gu, Seoul. It was hosted by Kim Hee-chul, Han Jin and Yang Se-hyung. The nominees were chosen from MBC variety, music shows and sitcom that aired from December 2016 to November 2017.",2017 MBC Entertainment Awards,20
"Arcado

Arcado may refer to:",Arcado,21
"Jacy Reese

Jacy Reese is a writer, social scientist, and co-founder of Sentience Institute. He previously worked as a Senior Fellow at Sentience Politics, and before that at Animal Charity Evaluators as Chair of the Board of Directors and then as a full-time researcher. His research focuses on the topics of for effective altruism, anti-speciesism, and plant-based and cellular agriculture. Reese was recognized as one of Vice’s “Humans of the Year” in December 2017 along with his co-founder Kelly Witwicki.

Sentience Institute is a nonprofit think tank working to understand and facilitate the expansion of humanity’s moral circle to all sentient beings. Since they were founded in June 2017, they have published several research reports including a study of the British antislavery movement, a study of the French nuclear power movement, and a poll of American attitudes towards “animal farming and animal-free food.” The poll was done in collaboration with Ipsos Group and was covered by media for results like that 47% of Americans support “a ban on slaughterhouses.” The organization receives its funding from individual donors and other charities like the Centre for Effective Altruism and the Effective Altruism Foundation.

Reese has also discussed the issue of wild animal suffering, arguing that humans should act on behalf of wild animals to alleviate their suffering if it can be done safely and effectively. His 2015 Vox article on the topic was criticized by writers who argued we shouldn’t intervene or that we should instead focus on helping domestic animals.

In fall 2018, he is publishing his first book, ""The End of Animal Farming"", which “outlines an evidence-based roadmap to a humane, ethical, efficient food system where slaughterhouses are obsolete.”",Jacy Reese,22
"Cerddor y Tonic Sol-ffa

Cerddor y Tonic Sol-ffa was a 19th-century monthly Welsh language magazine. It was first published by R. Hughes and Son in Wrexham in 1869, when it was edited by its founder, Methodist minister and musician John Roberts (also an editor of 'Y Cerddor Cymreig' and of 'Y Goleuad'). He had studied tonic sol-ffa since 1863, and the publication, which contained compositions, and articles about music and musicians, was intended for use by students during tonic-solffa lessons.",Cerddor y Tonic Sol ffa,23
"Caldwell Carnegie Library (Caldwell, Kansas)

The Caldwell Carnegie Library, located at 13 N. Osage St. in Caldwell, Kansas, was completed in 1912. It was listed on the National Register of Historic Places in 1983.

It is a Carnegie library designed by Wichita architect Fred G. McCune. It is a concrete block building with a brick veneer.",Caldwell Carnegie Library  Caldwell  Kansas ,24
"Sampur Stupa

Sampur Soodaikudah archaeological site is a historic site with archaeological evidences, situated in Mathalamalai mountain, Sampur, Sri Lanka. The site was discovered by a group of archaeologists, during an archaeological excavation done in the Sampur area in December 2017. However the ruins, including an old Stupa were completely destroyed and flattened out by a group of vandals on 18 December, few days after the discovery.

During the Sri Lankan civil war, many of the archaeological sites in the North and Eastern provinces of Sri Lanka were not properly investigated or recorded as the prevailed threats from the LTTE rebel group. After the defeat of LTTE in 2009, the archaeology department carried out several projects across the North & Eastern provinces to investigate and identify the places with archaeological evidences and the some of places were finally declared as archaeologically protected reserves and monuments. As the instructions given by Akila Viraj Kariyawasam, a similar project was started after the 2015 to investigate the unknown archaeological sites in the Eastern province of the country. In December 2017, as a part of the project a group of archaeologists unearthed a dilapidated Stupa during an excavation done in a Hindu temple premises in Soodaikudah in Sampur. According to the initial evaluations done by the archaeologists, the Stupa is a construction of early Anuradhapura period (377 BC to 1017 AD) with a girth of 15 feet.

The ruins of the stupa were found on land which is used by a recently built Hindu shrine. The local people in Soodaikudah are said to be displaced in 2006 along with Muttur people and had been resettling around the area from 2013. The Hindu shrine, constructed near to the stupa mound, was officially registered in 2014.

A few days after the identification, the Stupa mound had been cleared completely by a group of people using a bulldozer before the Department declared it as an archaeologically and historically important site. The destruction was first revealed by police who conducted investigations following a tip-off given on the police hotline. The incident was reported to the authorities including the Secretary to the President and the Eastern Province Governor by the chief monk of Seruvila Mangala Raja Maha Vihara. A police investigation was started following the incident and meanwhile a court order was issued by the Muttur magistrate, suspending all rehabilitation works on the Hindu temple.

On 23 December, the speaker Karu Jayasuriya revealed that the people who destroyed the Soodaikudah Stupa in Sampur has been identified. A few days after the statement, three people were arrested with a bulldozer and a lorry which were used to destroy the Stupa. The bulldozer had been brought to the Hindu shrine to dig a drinking well around 100 metres away from the Kovil but they had used the vehicle to destroy the Stupa. Local media reported that the two drivers involved in the destruction of the Stupa had met with accidents at different places on the same day. 

On 29 December the Department of Archaeology announced that they will take over the entire land area, where the Sudaikuda Stupa was located for further preservation. In January police arrested three senior members of the Hindu temple board who had connected with the incident.",Sampur Stupa,25
"R.S. Prabhu

R.S Prabhu is an Indian Film producer and Film director in malayalam.

He was born to Ramachandra Prabhu and Yasodha on 5th May 1930 in Ernakulam, Kerala, India. He is married to Sarada and he he has two children. S. Rajagopal, S. Ramesh. 

He started his career as a production manager in Rakthabandham in 1950. After 15 years, In 1965 he produced and directed Rajamalli.He has also acted in Rakthabandham, Moodupadam, Asuravithu.

Vayalar memorial award in 1997 and Kerala critic film award.",R S  Prabhu,26
